GR003PFCPANIN034,REKSA DANA TERPROTEKSI PANIN 34,"Panin Asset Management, PT",capital_protected_fund
GR003PFCPANIN035,REKSA DANA TERPROTEKSI PANIN 35,PT Panin Asset Management,capital_protected_fund
GR003PFCPANIN036,REKSA DANA TERPROTEKSI PANIN 36,PT Panin Asset Management,capital_protected_fund
GR003PFCPANIN037,REKSA DANA TERPROTEKSI PANIN 37,PT Panin Asset Management,capital_protected_fund
GR003PFCPANIN038,REKSA DANA TERPROTEKSI PANIN 38,PT Panin Asset Management,capital_protected_fund
GR003PFCPANIN039,REKSA DANA TERPROTEKSI PANIN 39,PT Panin Asset Management,capital_protected_fund
GR003PFCPANIN040,REKSA DANA TERPROTEKSI PANIN 40,PT Panin Asset Management,capital_protected_fund
GR003PFCPANIN041,REKSA DANA TERPROTEKSI PANIN 41,PT Panin Asset Management,capital_protected_fund
GR003PFCPANIN042,REKSA DANA TERPROTEKSI PANIN 42,PT Panin Asset Management,capital_protected_fund
GR003PFCPANIN043,REKSA DANA TERPROTEKSI PANIN 43,PT Panin Asset Management,capital_protected_fund
GR003PFCPANIN505,PANIN 5,PT Panin Asset Management,capital_protected_fund
GR003PFCPANIN900,Reksa Dana Terproteksi Panin 9,"Panin Asset Management, PT",capital_protected_fund
GR003PFCPANSDG01,REKSA DANA TERPROTEKSI PANIN SUSTAINABLE DEVELOPMENT GOALS 1,PT Panin Asset Management,capital_protected_fund
GR003PFCRDTPNN01,REKSA DANA TERPROTEKSI PANIN 1,"Panin Asset Management, PT",capital_protected_fund
H7003,REKSA DANA LAUTANDHANA SAHAM PRIMA,"Lautandhana Investment Management, PT",equity_fund
HK002MMCRDOKPU00,REKSA DANA OSO KARIMATA PASAR UANG,"OSO Manajemen Investasi, PT",money_market_fund
HK002OSOMEF,REKSA DANA OSO MOLUCCAS EQUITY FUND,"OSO Manajemen Investasi, PT",equity_fund
HK002PFCRDOSO603,REKSA DANA TERPROTEKSI OSO DANA TERPROTEKSI VI,"OSO Manajemen Investasi, PT",capital_protected_fund
HK002SKSCELKUK00,REKSA DANA SYARIAH BERBASIS SUKUK OSO CELEBES SYARIAH SUKUK,"OSO Manajemen Investasi, PT",sukuk_based_fund
HKRDOSEF,REKSA DANA OSO SYARIAH EQUITY FUND,"OSO Manajemen Investasi, PT",equity_fund
HP002EQCHPEPRO00,REKSADANA HPAM EKUITAS PROGRESIF,"Henan Putihrai Asset Management, PT",rd_-_saham
HP002EQCSMARTQ30,Reksa Dana HPAM Ekuitas Smart 30,"Henan Putihrai Asset Management, PT",equity_fund
HP002EQCTACTIC00,REKSA DANA HPAM TACTICAL EQUITY,"Henan Putihrai Asset Management, PT",equity_fund
HP002EQSBERKAH00,REKSA DANA SYARIAH HPAM EKUITAS SYARIAH BERKAH,"Henan Putihrai Asset Management, PT",equity_fund
HP002FICPTPRIM00,REKSA DANA HPAM PENDAPATAN TETAP PRIMA,"Henan Putihrai Asset Management, PT",fixed_income_fund
HP002MMCPSUDMS01,REKSA DANA HPAM PASAR UANG DINAMIS,"Henan Putihrai Asset Management, PT",money_market_fund
HP002MMCULTIMM00,REKSADANA HPAM ULTIMA MONEY MARKET,PT Henan Putihrai Asset Management,money_market_fund
HP002MXC01FLEX00,REKSA DANA HPAM FLEXI INDONESIA SEHAT,PT Henan Putihrai Asset Management,mixed_asset_fund
HP002MXC01FLEX01,REKSA DANA HPAM FLEXI INDONESIA SEHAT KELAS A,PT Henan Putihrai Asset Management,mixed_asset_fund
HP002MXC01FLEX02,REKSA DANA HPAM FLEXI INDONESIA SEHAT KELAS B,PT Henan Putihrai Asset Management,mixed_asset_fund
HP002MXC01FLEX03,REKSA DANA HPAM FLEXI INDONESIA SEHAT KELAS C,PT Henan Putihrai Asset Management,mixed_asset_fund
HP002MXC01FLEX04,REKSA DANA HPAM FLEXI INDONESIA SEHAT KELAS D,PT Henan Putihrai Asset Management,mixed_asset_fund
HP002MXC01FLEX05,REKSA DANA HPAM FLEXI INDONESIA SEHAT KELAS E,PT Henan Putihrai Asset Management,mixed_asset_fund
HP002MXC01HPBF00,REKSA DANA HPAM BALANCED FUND,"Henan Putihrai Asset Management, PT",mixed_asset_fund
HP002MXC01HPBF01,REKSA DANA HPAM BALANCED FUND KELAS A,"Henan Putihrai Asset Management, PT",mixed_asset_fund
HP002MXC01HPBF02,REKSA DANA HPAM BALANCED FUND KELAS B,"Henan Putihrai Asset Management, PT",mixed_asset_fund
HP002MXC01HPBF03,REKSA DANA HPAM BALANCED FUND KELAS C,"Henan Putihrai Asset Management, PT",mixed_asset_fund
HP002PFCHPAMUP01,REKSA DANA TERPROTEKSI HPAM ULTIMA PROTECTED I,"Henan Putihrai Asset Management, PT",capital_protected_fund
HP002PFCHPAMUP02,REKSA DANA TERPROTEKSI HPAM ULTIMA PROTECTED II,"Henan Putihrai Asset Management, PT",capital_protected_fund
HP002PFCHPAMUP03,Reksa Dana Terproteksi HPAM Ultima Protected III,"Henan Putihrai Asset Management, PT",capital_protected_fund
HP002PFCPPRIMA02,REKSA DANA TERPROTEKSI HPAM PROTEKSI PRIMA II,"Henan Putihrai Asset Management, PT",capital_protected_fund
HP002PFCRDTHS100,REKSA DANA TERPROTEKSI HPAM SMART PROTECTED X,"Henan Putihrai Asset Management, PT",capital_protected_fund
HP002PFCRDTHS202,REKSA DANA TERPROTEKSI HPAM STRATEGIC PROTECTED II,"Henan Putihrai Asset Management, PT",capital_protected_fund
HP002PFCRDTHSP00,REKSA DANA TERPROTEKSI HPAM STRATEGIC PROTECTED,"Henan Putihrai Asset Management, PT",capital_protected_fund
HP002PFCSMAPRO17,REKSA DANA TERPROTEKSI HPAM SMART PROTECTED XVII,"Henan Putihrai Asset Management, PT",capital_protected_fund
HP002PFCSMAPRO18,REKSA DANA TERPROTEKSI HPAM SMART PROTECTED XVIII,"Henan Putihrai Asset Management, PT",capital_protected_fund
HP002PFCSMAPRO19,REKSA DANA TERPROTEKSI HPAM SMART PROTECTED XIX,"Henan Putihrai Asset Management, PT",capital_protected_fund
HP002PFCSMARTP11,REKSA DANA TERPROTEKSI HPAM SMART PROTECTED XI,"Henan Putihrai Asset Management, PT",capital_protected_fund
HP002PFCSMARTP12,REKSA DANA TERPROTEKSI HPAM SMART PROTECTED XII,"Henan Putihrai Asset Management, PT",capital_protected_fund
HP002PFCSMARTP15,REKSA DANA TERPROTEKSI HPAM SMART PROTECTED XV,"Henan Putihrai Asset Management, PT",capital_protected_fund
HP002PFCSTRPRO04,REKSA DANA TERPROTEKSI HPAM STRATEGIC PROTECTED IV,"Henan Putihrai Asset Management, PT",capital_protected_fund
HP002PFCTHSGPF00,REKSA DANA TERPROTEKSI HENAN SMART GROWTH PROTECTED FUND,PT Henan Putihrai Asset Management,capital_protected_fund
HP002PFSPPRIMA03,REKSA DANA SYARIAH TERPROTEKSI HPAM PROTEKSI PRIMA SYARIAH III,PT Henan Putihrai Asset Management,capital_protected_fund
HP002PFSPPRIMA04,REKSA DANA SYARIAH TERPROTEKSI HPAM PROTEKSI PRIMA SYARIAH IV,PT Henan Putihrai Asset Management,capital_protected_fund
HP002SMARTP,REKSA DANA TERPROTEKSI HPAM SMART PROTECTED VII,"Henan Putihrai Asset Management, PT",capital_protected_fund
HPAM PRIMA,REKSA DANA TERPROTEKSI HPAM PROTEKSI PRIMA,"Henan Putihrai Asset Management, PT",capital_protected_fund
HPAM SAHAM D,REKSA DANA HPAM SAHAM DINAMIS,"Henan Putihrai Asset Management, PT",equity_fund
HPAM-ES,REKSA DANA HPAM INVESTA EKUITAS STRATEGIS,"Henan Putihrai Asset Management, PT",equity_fund
HPAM-P1,Reksadana HPAM Premium-1,PT Henan Putihrai Asset Management,mixed_asset_fund
HPAM-SY,REKSADANA HPAM SYARIAH EKUITAS,PT Pratama Capital Assets Management,equity_fund
HPAM-UL,REKSADANA HPAM ULTIMA EKUITAS,PT Henan Putihrai Asset Management,equity_fund
HPULTBLC01,REKSA DANA HPAM ULTIMA BALANCE,"Henan Putihrai Asset Management, PT",mixed_asset_fund
HPULTOPLUS,REKSA DANA HPAM ULTIMA OBLIGASI PLUS,"Henan Putihrai Asset Management, PT",fixed_income_fund
IAI02EQC21IAE101,REKSA DANA INDO ARTHABUANA INVESTAMA EKUITAS I,"Indo Arthabuana Investama,PT",equity_fund
IAI02MXC22IAGC00,REKSA DANA CAMPURAN INDO ARTHABUANA GOLDEN COMPASS,PT. Indo Arthabuana Investama,mixed_asset_fund
IAM02EQCRDIELP00,Reksa Dana Indosterling Ekuitas Likuid Plus,"INDOSTERLING ASET MANAJEMEN, PT",equity_fund
IAM02MMCRDIPSU00,Reksa Dana Indosterling Pasar Uang,"INDOSTERLING ASET MANAJEMEN, PT",money_market_fund
ID002EQC21SEBK00,RD SENTRA EKUITAS BERKEMBANG,PT Anugerah Sentra Investama,equity_fund
ID002EQC21SEGG00,REKSA DANA SENTRA EKUITAS GEMILANG,"Anugerah Sentra Investama, PT",equity_fund
IDAMAN,REKSA DANA INVESTA DANA DOLLAR MANDIRI,"Mandiri Manajemen Investasi, PT",fixed_income_fund
IF002EQC01NUSA00,REKSA DANA SAM DANA SAHAM NUSANTARA,"Samuel Aset Manajemen, PT",equity_fund
IF002EQC01NUSA01,REKSA DANA SAM DANA SAHAM NUSANTARA KELAS A,"Samuel Aset Manajemen, PT",equity_fund
IF002EQC01NUSA02,REKSA DANA SAM DANA SAHAM NUSANTARA KELAS S,"Samuel Aset Manajemen, PT",equity_fund
IF002EQCRDSBEF00,Reksa Dana SAM Beta Plus Equity Fund,"Samuel Aset Manajemen, PT",equity_fund
IF002EQCSDCEQC00,REKSA DANA SAM DANA CERDAS,PT Samuel Aset Manajemen,equity_fund
IF002EQSSSEFEQ00,REKSA DANA SAM SHARIA EQUITY FUND,"Samuel Aset Manajemen, PT",equity_fund
IF002FIC01OPTI00,REKSA DANA SAM OBLIGASI OPTIMA,"Samuel Aset Manajemen, PT",fixed_income_fund
IF002FIC01OPTI01,REKSA DANA SAM OBLIGASI OPTIMA KELAS A,"Samuel Aset Manajemen, PT",fixed_income_fund
IF002FIC01OPTI02,REKSA DANA SAM OBLIGASI OPTIMA KELAS D,"Samuel Aset Manajemen, PT",fixed_income_fund
IF002FIC01OPTI03,REKSA DANA SAM OBLIGASI OPTIMA KELAS S,"Samuel Aset Manajemen, PT",fixed_income_fund
IF002FICSDOPMX00,REKSA DANA SAM DANA OBLIGASI PRIMA,"Samuel Aset Manajemen, PT",fixed_income_fund
IF002FICSDOSXX00,REKSA DANA SAM DANA OBLIGASI STRATEGIS,"Samuel Aset Manajemen, PT",fixed_income_fund
IF002FICSDPTXX00,REKSA DANA SAM DANA PENDAPATAN TETAP,"Samuel Aset Manajemen, PT",fixed_income_fund
IF002GFSSGSEQD00,REKSA DANA SYARIAH SAM GLOBAL SHARIA ESG EQUITY DOLLAR,"Samuel Aset Manajemen, PT",global_fund
IF002MMSSDLMMS00,Reksa Dana Syariah SAM Dana Likuid Syariah,"Samuel Aset Manajemen, PT",money_market_fund
IF002MMSSWSLMM00,REKSA DANA SYARIAH SAM WAHED SHARIA LIQUID FUND,"Samuel Aset Manajemen, PT",money_market_fund
IF002MXC01SMNC00,REKSA DANA SAM MUTIARA NUSA CAMPURAN,PT Samuel Aset Manajemen,mixed_asset_fund
IF002MXC01SMNC02,REKSA DANA SAM MUTIARA NUSA CAMPURAN KELAS SSU PRATAMA,PT Samuel Aset Manajemen,mixed_asset_fund
IF002MXC01SMNC03,REKSA DANA SAM MUTIARA NUSA CAMPURAN KELAS SSU PRIMA,PT Samuel Aset Manajemen,mixed_asset_fund
IF002MXCKMBTMB00,SAM KOMBINASI BERTUMBUH,PT Samuel Aset Manajemen,mixed_asset_fund
IF002MXCSAMMNC00,Reksa Dana SAM Mutiara Nusa Campuran,"Samuel Aset Manajemen, PT",mixed_asset_fund
IF002MXCSCSMXC00,Reksa Dana SAM Cipta Sejahtera Campuran,"Samuel Aset Manajemen, PT",mixed_asset_fund
IF002MXCSDBMXC00,SAM Dana Berkembang,"Samuel Aset Manajemen, PT",mixed_asset_fund
IF002MXCSEJBER00,SAM SEJAHTERA BERSAMA CAMPURAN,PT Samuel Aset Manajemen,mixed_asset_fund
IF002PFCDANOBL09,Reksa Dana Terproteksi Sam Dana Obligasi Terproteksi 9,"Samuel Aset Manajemen, PT",capital_protected_fund
IF002PFCDOTPF808,REKSA DANA TERPROTEKSI SAM DANA OBLIGASI TERPROTEKSI 8,"Samuel Aset Manajemen, PT",capital_protected_fund
IF002PFCRDTSDT03,REKSA DANA TERPROTEKSI SAM DANA TERPROTEKSI SERI 3,"Samuel Aset Manajemen, PT",capital_protected_fund
IF002PFCSDPROT10,REKSA DANA TERPROTEKSI SAM DANA OBLIGASI TERPROTEKSI 10,"Samuel Aset Manajemen, PT",capital_protected_fund
IF002PFCSDTSD202,REKSA DANA TERPROTEKSI SAM DANA TERPROTEKSI SERI 2,"Samuel Aset Manajemen, PT",capital_protected_fund
IF002PFCSSPROT05,REKSA DANA TERPROTEKSI SAM SEJAHTERA TERPROTEKSI 5,PT Samuel Aset Manajemen,capital_protected_fund
IF002PFCSSTPF100,Reksa Dana Terproteksi SAM Sejahtera Terproteksi,"Samuel Aset Manajemen, PT",capital_protected_fund
IF002PFCSSTPF303,REKSA DANA TERPROTEKSI SAM SEJAHTERA TERPROTEKSI 3,"Samuel Aset Manajemen, PT",capital_protected_fund
IF002STABIFI,DANA OBLIGASI STABIL,PT Samuel Aset Manajemen,fixed_income_fund
IF225SDOTPF,SAMUEL DANA OBLIGASI TERPROTEKSI,"Samuel Aset Manajemen, PT",capital_protected_fund
IIM02EQCINUSAN18,REKSA DANA INSIGHT NUSANTARA EQUITY FUND (I-NUSANTARA),PT Insight Investments Management,equity_fund
IIM02FIC01GOLF00,REKSA DANA FIXED INCOME INSIGHT TRIM GOLF PRO ACCELERATION FUND I GOLF,PT Insight Investments Management,fixed_income_fund
IIM02FIC01GOLF01,REKSA DANA FIXED INCOME INSIGHT TRIM GOLF PRO ACCELERATION FUND I GOLF KELAS A,PT Insight Investments Management,fixed_income_fund
IIM02FIC01GOLF02,REKSA DANA FIXED INCOME INSIGHT TRIM GOLF PRO ACCELERATION FUND I GOLF KELAS B,PT Insight Investments Management,fixed_income_fund
IIM02FICIPRIME00,Reksa Dana Insight Prime Fixed Income Fund,"Insight Investments Management, PT",fixed_income_fund
IIM02FICIPRIOR00,REKSA DANA INSIGHT PRIORITY FIXED INCOME FUND,"Insight Investments Management, PT",fixed_income_fund
IIM02FICIRDPT100,REKSA DANA INSIGHT PENDAPATAN TETAP 1,"Insight Investments Management, PT",fixed_income_fund
IIM02IFCISRILQ00,REKSA DANA INDEKS INSIGHT SRI KEHATI LIKUID I SRI LIKUID,PT Insight Investments Management,index_fund
IIM02MMCIDAKAR00,REKSA DANA INSIGHT DANAKARTA PASAR UANG,"Insight Investments Management, PT",money_market_fund
IIM02MMCIPAUDL00,REKSA DANA INSIGHT PASAR UANG DANA LIKUID,"Insight Investments Management, PT",money_market_fund
IIM02MMCIRCASH00,Reksa Dana Insight Retail Cash Fund,"Insight Investments Management, PT",money_market_fund
IIM02MXCIBENEF00,REKSA DANA INSIGHT BENEFIT BALANCED FUND,"Insight Investments Management, PT",mixed_asset_fund
IIM02MXCIGROWT00,REKSADANA INSIGHT GROWTH BALANCED FUND,PT Insight Investments Management,mixed_asset_fund
IIM02MXCINEXTG00,REKSA DANA INSIGHT TUNAS BANGSA I NEXT G,PT Insight Investments Management,mixed_asset_fund
IIM02MXCINEXTG02,REKSA DANA INSIGHT TUNAS BANGSA BALANCED FUND 2 I NEXT G 2,"Insight Investments Management, PT",mixed_asset_fund
IIM02PFCIPROTK18,REKSA DANA TERPROTEKSI INSIGHT TERPROTEKSI 18,"Insight Investments Management, PT",capital_protected_fund
IIM02PFCIPROTK27,Reksa Dana Terproteksi Insight Terproteksi 27,"Insight Investments Management, PT",capital_protected_fund
IIM02PFCIPROTK31,REKSA DANA TERPROTEKSI INSIGHT TERPROTEKSI 31,"Insight Investments Management, PT",capital_protected_fund
IIM02PFCIPROTK34,REKSA DANA TERPROTEKSI INSIGHT TERPROTEKSI 34,"Insight Investments Management, PT",capital_protected_fund
IIM02PFCIPROTK35,REKSA DANA TERPROTEKSI INSIGHT TERPROTEKSI 35,"Insight Investments Management, PT",capital_protected_fund
IIM02PFCIPROTK39,REKSA DANA TERPROTEKSI INSIGHT TERPROTEKSI 39,"Insight Investments Management, PT",capital_protected_fund
IIM02PFCIPROTK42,REKSA DANA TERPROTEKSI INSIGHT TERPROTEKSI 42,"Insight Investments Management, PT",capital_protected_fund
IIM02PFCIPROTK44,REKSA DANA TERPROTEKSI INSIGHT TERPROTEKSI 44,"Insight Investments Management, PT",capital_protected_fund
IIM02PFCIPROTK45,REKSA DANA TERPROTEKSI INSIGHT TERPROTEKSI 45,"Insight Investments Management, PT",capital_protected_fund
IIM02PFCIPROTK46,REKSA DANA TERPROTEKSI INSIGHT TERPROTEKSI 46,"Insight Investments Management, PT",capital_protected_fund
IIM02PFCIPROTK48,REKSA DANA TERPROTEKSI INSIGHT TERPROTEKSI 48,"Insight Investments Management, PT",capital_protected_fund
IIM02PFCIPROTK49,REKSA DANA TERPROTEKSI INSIGHT TERPROTEKSI 49,"Insight Investments Management, PT",capital_protected_fund
IIM02PFCIPROTK50,REKSA DANA TERPROTEKSI INSIGHT TERPROTEKSI 50,"Insight Investments Management, PT",capital_protected_fund
IIM02PFCIPROTK52,REKSA DANA TERPROTEKSI INSIGHT TERPROTEKSI 52,"Insight Investments Management, PT",capital_protected_fund
IIM02PFCIPROTK53,REKSA DANA TERPROTEKSI INSIGHT TERPROTEKSI 53,"Insight Investments Management, PT",capital_protected_fund
IIM02PFCIPROTK54,REKSA DANA TERPROTEKSI INSIGHT TERPROTEKSI 54,"Insight Investments Management, PT",capital_protected_fund
IIM02PFCIPROTK55,REKSA DANA TERPROTEKSI INSIGHT TERPROTEKSI 55,"Insight Investments Management, PT",capital_protected_fund
IIM02PFCIPROTK58,REKSA DANA TERPROTEKSI INSIGHT TERPROTEKSI 58,"Insight Investments Management, PT",capital_protected_fund
IIM02PFCIPROTK60,Reksa Dana Terproteksi Insight Terproteksi 60,"Insight Investments Management, PT",capital_protected_fund
IIM02PFCIPROTK62,REKSA DANA TERPROTEKSI INSIGHT TERPROTEKSI 62,"Insight Investments Management, PT",capital_protected_fund
IIM02PFCIPROTK63,REKSA DANA TERPROTEKSI INSIGHT TERPROTEKSI 63,"Insight Investments Management, PT",capital_protected_fund
IIM02PFCIPROTK64,REKSA DANA TERPROTEKSI INSIGHT TERPROTEKSI 64,PT Insight Investments Management,capital_protected_fund
IIM02PFCIPROTK69,REKSA DANA TERPROTEKSI INSIGHT TERPROTEKSI 69,"Insight Investments Management, PT",capital_protected_fund
IIM02PFSINSYAR09,REKSA DANA SYARIAH TERPROTEKSI INSIGHT TERPROTEKSI SYARIAH IX,PT Insight Investments Management,capital_protected_fund
IIM02PFSIPROSY03,RDST INSIGHT TERPROTEKSI SYARIAH III,"Insight Investments Management, PT",capital_protected_fund
IIM02PFSIPROSY05,REKSA DANA SYARIAH TERPROTEKSI INSIGHT TERPROTEKSI SYARIAH V,"Insight Investments Management, PT",capital_protected_fund
IIM02PFSIPROSY08,REKSA DANA SYARIAH TERPROTEKSI INSIGHT TERPROTEKSI SYARIAH VIII,"Insight Investments Management, PT",capital_protected_fund
IIM02PFSIPROSY10,REKSA DANA SYARIAH TERPROTEKSI INSIGHT TERPROTEKSI SYARIAH X,PT Insight Investments Management,capital_protected_fund
IIM02PFSITSVII00,REKSA DANA SYARIAH TERPROTEKSI INSIGHT TERPROTEKSI SYARIAH VII,"Insight Investments Management, PT",capital_protected_fund
IIM02PFSRDSIN606,REKSA DANA SYARIAH TERPROTEKSI INSIGHT TERPROTEKSI SYARIAH VI,"Insight Investments Management, PT",capital_protected_fund
IIM02PROTK11,REKSA DANA TERPROTEKSI INSIGHT TERPROTEKSI 11,"Insight Investments Management, PT",capital_protected_fund
IMBF,REKSA DANA I AM BOND FUND,PT Indoasia Aset Manajemen,fixed_income_fund
IN002EQSRDSNSB00,REKSA DANA SYARIAH NARADA SAHAM BERKAH SYARIAH,"Narada Aset Manajemen, PT",equity_fund
IN002MMC25NMCF00,Reksa Dana Narada Milenesia Cash Fund,"Narada Aset Manajemen, PT",money_market_fund
IN002PFC23NAP202,RDT NARADA PROTEKSI II,"Narada Aset Manajemen, PT",capital_protected_fund
INCOMESTREAM,REKSA DANA BAHANA INCOME STREAM,"Bahana TCW Investment Management, PT",fixed_income_fund
IND02IAMBPMI,I AM BUMN BALANCED PLUS FUND,PT Indoasia Aset Manajemen,mixed_asset_fund
IND02IAMEFFI,I AM EQUITY FUND,PT Indoasia Aset Manajemen,equity_fund
INTPROIX,REKSA DANA TERPROTEKSI PREMIER PROTEKSI IX,"Indo Premier Investment Management, PT",capital_protected_fund
IPFIS,REKSA DANA PREMIER FIXED INCOME SYARIAH,"Indo Premier Investment Management, PT",fixed_income_fund
JAM02MMCJAMMMF00,REKSA DANA JARVIS MONEY MARKET FUND,"Jarvis Aset Manajemen, PT",money_market_fund
JAM02MXCJAMBAF00,REKSA DANA JARVIS BALANCED FUND,"Jarvis Aset Manajemen, PT",mixed_asset_fund
JFI02FICCORTHE00,REKSA DANA CORPUS THEOLOGIA FIXED INCOME FUND,"Corpus Kapital Manajemen, PT",fixed_income_fund
JFI02FICOBPLUS00,REKSA DANA LIF BOND PLUS,PT Lif Manajemen Investasi,fixed_income_fund
JFI02MMCLIMOMA00,REKSA DANA LIF MONEY MARKET,PT Lif Manajemen Investasi,money_market_fund
JFI02MXCLIBAMA00,REKSA DANA LIF BALANCED OPTIMA,PT Lif Manajemen Investasi,mixed_asset_fund
KGKI45,REKSA DANA KRESNA INDEKS 45,"Kresna Asset Management, PT",index_fund
KGSF,REKSA DANA KRESNA FLEXIMA,"Kresna Asset Management, PT",mixed_asset_fund
KGSO,REKSA DANA KRESNA OLYMPUS,"Kresna Asset Management, PT",fixed_income_fund
KI002EQCCERDAS00,REKSA DANA RENCANA CERDAS,"Ciptadana Asset Management, PT",equity_fund
KI002EQCEQTPLS00,REKSA DANA CIPTA EQUITY PLUS,"Ciptadana Asset Management, PT",equity_fund
KI002EQCGMLEQT00,Reksa Dana Cipta Ovo Ekuitas,"Ciptadana Asset Management, PT",equity_fund
KI002EQCSAHUNG00,Reksa Dana Cipta Saham Unggulan,"Ciptadana Asset Management, PT",equity_fund
KI002EQSSAUNRI00,REKSA DANA SYARIAH CIPTA SAHAM UNGGULAN SYARIAH,"Ciptadana Asset Management, PT",equity_fund
KI002EQSSYAEQT00,REKSA DANA CIPTA SYARIAH EQUITY,"Ciptadana Asset Management, PT",equity_fund
KI002FICDANOBL00,Reksa Dana Cipta Dana Obligasi,"Ciptadana Asset Management, PT",fixed_income_fund
KI002FICOBLIMA00,Reksa Dana Cipta Obligasi Prima,"Ciptadana Asset Management, PT",fixed_income_fund
KI002FICOBLUNG00,REKSA DANA CIPTA OBLIGASI UNGGULAN,"Ciptadana Asset Management, PT",fixed_income_fund
KI002FICOBLUSD00,Reksa Dana Cipta Obligasi USD,"Ciptadana Asset Management, PT",fixed_income_fund
KI002FISCIPTUS00,REKSA DANA SYARIAH CIPTA PENDAPATAN TETAP UNGGULAN SYARIAH,"Ciptadana Asset Management, PT",fixed_income_fund
KI002IFSINDEKS00,Reksa Dana Syariah Indeks Cipta Syariah Indeks,"Ciptadana Asset Management, PT",index_fund
KI002MMCDANKSU00,REKSA DANA CIPTA DANA KAS UNGGULAN,"Ciptadana Asset Management, PT",money_market_fund
KI002MMCDANLID00,REKSA DANA CIPTA LIKUID FUND,"Ciptadana Asset Management, PT",money_market_fund
KI002MMCRDCDKP00,REKSA DANA CIPTA DANA KAS PRIMA,"Ciptadana Asset Management, PT",money_market_fund
KI002MMSKASRIA00,REKSA DANA SYARIAH CIPTA DANA KAS SYARIAH,"Ciptadana Asset Management, PT",money_market_fund
KI002MXCDANPRI00,REKSA DANA CIPTA DANA PRIMA,"Ciptadana Asset Management, PT",mixed_asset_fund
KI002MXCKASBER00,Reksa Dana Cipta Kasih Berimbang,"Ciptadana Asset Management, PT",mixed_asset_fund
KI002MXSSYABAL00,REKSA DANA CIPTA SYARIAH BALANCE,"Ciptadana Asset Management, PT",mixed_asset_fund
KI002PFCCPRO1919,REKSA DANA TERPROTEKSI CIPTA PROTEKSI XIX,"Ciptadana Asset Management, PT",capital_protected_fund
KI002PFCCPRO2222,REKSA DANA TERPROTEKSI CIPTA PROTEKSI XXII,"Ciptadana Asset Management, PT",capital_protected_fund
KI002PFCCPRO2323,REKSA DANA TERPROTEKSI CIPTA PROTEKSI XXIII,"Ciptadana Asset Management, PT",capital_protected_fund
KI002PFCCPRO2525,REKSA DANA TERPROTEKSI CIPTA PROTEKSI XXV,"Ciptadana Asset Management, PT",capital_protected_fund
KI002PFCCPRO2626,REKSA DANA TERPROTEKSI CIPTA PROTEKSI XXVI,"Ciptadana Asset Management, PT",capital_protected_fund
KI002PFCCPRO2727,REKSA DANA TERPROTEKSI CIPTA PROTEKSI XXVII,PT Ciptadana Asset Management,capital_protected_fund
KI002PFCCPRO2828,REKSA DANA TERPROTEKSI CIPTA PROTEKSI XXVIII,PT Ciptadana Asset Management,capital_protected_fund
KI002PFCCPRO2929,REKSA DANA TERPROTEKSI CIPTA PROTEKSI XXIX,PT Ciptadana Asset Management,capital_protected_fund
KI002PFCCPXXIV00,REKSA DANA TERPROTEKSI CIPTA PROTEKSI XXIV,"Ciptadana Asset Management, PT",capital_protected_fund
KI002PFCPROTEK09,REKSA DANA TERPROTEKSI CIPTA PROTEKSI IX,"Ciptadana Asset Management, PT",capital_protected_fund
KI002PFCPROTEK10,REKSA DANA TERPROTEKSI CIPTA PROTEKSI X,"Ciptadana Asset Management, PT",capital_protected_fund
KI002PFCPROTEK13,REKSA DANA TERPROTEKSI CIPTA PROTEKSI XIII,"Ciptadana Asset Management, PT",capital_protected_fund
KI002PFCRDTC1818,REKSA DANA TERPROTEKSI CIPTA PROTEKSI XVIII,"Ciptadana Asset Management, PT",capital_protected_fund
KI002PROT04,REKSA DANA TERPROTEKSI CIPTA PROTEKSI IV,"Ciptadana Asset Management, PT",capital_protected_fund
KK002MMCPMMFDL00,REKSA DANA PHILLIP MMF DANA LIKUID,"Phillip Asset Management, PT",money_market_fund
KK002MMSPMMFSB00,REKSA DANA SYARIAH PHILLIP MONEY MARKET FUND SYARIAH BERMANFAAT,"Phillip Asset Management, PT",money_market_fund
KS002EQCRDSHKP00,Reksa Dana Saham Kresna Prima,"Kresna Asset Management, PT",equity_fund
KS002FIC24RBKA00,RD MR BOND KRESNA,PT Kresna Asset Management,fixed_income_fund
KS002PFCKRPC0505,REKSA DANA TERPROTEKSI KRESNA PROTEKSI CEMERLANG SERI 5,"Kresna Asset Management, PT",capital_protected_fund
KS002PFCRDTSG303,Reksa Dana Terproteksi Kresna Proteksi Sinar Gemilang Seri 3,"Kresna Asset Management, PT",capital_protected_fund
LAUTAN GF,REKSA DANA LAUTANDHANA GROWTH FUND,"Lautandhana Investment Management, PT",equity_fund
LG002EQC01TCOP00,REKSA DANA TRAM CONSUMPTION PLUS,"Trimegah Asset Management, PT",equity_fund
LG002EQC01TCOP01,REKSA DANA TRAM CONSUMPTION PLUS KELAS A,"Trimegah Asset Management, PT",equity_fund
LG002EQC01TCOP02,REKSA DANA TRAM CONSUMPTION PLUS KELAS B,"Trimegah Asset Management, PT",equity_fund
LG002EQC01TREF00,REKSA DANA TRIMEGAH EQUITY FOCUS 2,PT Trimegah Asset Management,equity_fund
LG002EQC01TREF01,REKSA DANA TRIMEGAH EQUITY FOCUS 2 KELAS A,PT Trimegah Asset Management,equity_fund
LG002EQC01TREF02,REKSA DANA TRIMEGAH EQUITY FOCUS 2 KELAS B,PT Trimegah Asset Management,equity_fund
LG002EQCKAPITA00,TRIM Kapital,"Trimegah Asset Management, PT",equity_fund
LG002EQCKPTPLS00,REKSA DANA TRIM KAPITAL PLUS,"Trimegah Asset Management, PT",equity_fund
LG002EQCTRSARA00,TRIMEGAH SAHAM NUSANTARA,PT Trimegah Asset Management,equity_fund
LG002FIC01TBGA00,REKSA DANA PENDAPATAN TETAP TRIMEGAH BAKTI GANESHA ABADI,PT Trimegah Asset Management,fixed_income_fund
LG002FIC01TBGA01,REKSA DANA PENDAPATAN TETAP TRIMEGAH BAKTI GANESHA ABADI KELAS A,PT Trimegah Asset Management,fixed_income_fund
LG002FIC01TBGA02,REKSA DANA PENDAPATAN TETAP TRIMEGAH BAKTI GANESHA ABADI KELAS B,PT Trimegah Asset Management,fixed_income_fund
LG002FIC01TBGA03,REKSA DANA PENDAPATAN TETAP TRIMEGAH BAKTI GANESHA ABADI KELAS C,PT Trimegah Asset Management,fixed_income_fund
LG002FIC01TDAT00,REKSA DANA TRIM DANA TETAP 2,PT Trimegah Asset Management,fixed_income_fund
LG002FIC01TDAT01,REKSA DANA TRIM DANA TETAP 2 KELAS A,PT Trimegah Asset Management,fixed_income_fund
LG002FIC01TDAT02,REKSA DANA TRIM DANA TETAP 2 KELAS B,PT Trimegah Asset Management,fixed_income_fund
LG002FIC01TRAM00,REKSA DANA PENDAPATAN TETAP TRIMEGAH ALMAMATER FUND,PT Trimegah Asset Management,fixed_income_fund
LG002FIC01TRAM01,REKSA DANA PENDAPATAN TETAP TRIMEGAH ALMAMATER FUND KELAS A,PT Trimegah Asset Management,fixed_income_fund
LG002FIC01TRAM02,REKSA DANA PENDAPATAN TETAP TRIMEGAH ALMAMATER FUND KELAS B,PT Trimegah Asset Management,fixed_income_fund
LG002FIC01TRAM03,REKSA DANA PENDAPATAN TETAP TRIMEGAH ALMAMATER FUND KELAS C,PT Trimegah Asset Management,fixed_income_fund
LG002FIC01TRSB00,REKSA DANA PENDAPATAN TETAP TRIMEGAH SEPAK BOLA MERAH PUTIH,PT Trimegah Asset Management,fixed_income_fund
LG002FIC01TRSB01,REKSA DANA PENDAPATAN TETAP TRIMEGAH SEPAK BOLA MERAH PUTIH KELAS A,PT Trimegah Asset Management,fixed_income_fund
LG002FIC01TRSB02,REKSA DANA PENDAPATAN TETAP TRIMEGAH SEPAK BOLA MERAH PUTIH KELAS B,PT Trimegah Asset Management,fixed_income_fund
LG002FIC01TRSF00,REKSA DANA TRAM STRATEGIC PLUS,PT Trimegah Asset Management,fixed_income_fund
LG002FIC01TRSF01,REKSA DANA TRAM STRATEGIC PLUS KELAS A,PT Trimegah Asset Management,fixed_income_fund
LG002FIC01TRSF02,REKSA DANA TRAM STRATEGIC PLUS KELAS B,PT Trimegah Asset Management,fixed_income_fund
LG002FICRDTDON00,REKSA DANA TRIMEGAH DANA OBLIGASI NUSANTARA,"Trimegah Asset Management, PT",fixed_income_fund
LG002FICTDTPRN00,Reksa Dana Trimegah Pendapatan Tetap Prima Nusa,"Trimegah Asset Management, PT",fixed_income_fund
LG002FICTRIFIP00,REKSA DANA TRIMEGAH FIXED INCOME PLAN,"Trimegah Asset Management, PT",fixed_income_fund
LG002FICTRONUS00,Reksa Dana Trimegah Obligasi Nusantara,"Trimegah Asset Management, PT",fixed_income_fund
